{
  "schemaVersion": 3,
  "dataSource": "benchmark-sync-static",
  "exporterVersion": "0.5.0",
  "workflowRunId": "41189157561",
  "mainCommit": "051754cf096f02b5ae33f65c5875d143413bce83",
  "generatedAt": "2026-10-31T09:34:33Z",
  "families": [
    {
      "familyId": "livebench",
      "title": "LiveBench",
      "overall": "livebench_overall",
      "boards": [
        {
          "id": "livebench_overall",
          "title": "LiveBench Overall",
          "isOverall": true,
          "modelCount": 32
        },
        {
          "id": "livebench_coding",
          "title": "LiveBench Coding",
          "isOverall": false,
          "modelCount": 32
        },
        {
          "id": "livebench_reasoning",
          "title": "LiveBench Reasoning",
          "isOverall": false,
          "modelCount": 32
        },
        {
          "id": "livebench_data_analysis",
          "title": "LiveBench Data Analysis",
          "isOverall": false,
          "modelCount": 32
        },
        {
          "id": "livebench_long_horizon",
          "title": "LiveBench Long Agentic",
          "isOverall": false,
          "modelCount": 32
        },
        {
          "id": "livebench_browser",
          "title": "LiveBench Browser",
          "isOverall": false,
          "modelCount": 32
        },
        {
          "id": "livebench_research",
          "title": "LiveBench Research",
          "isOverall": false,
          "modelCount": 32
        },
        {
          "id": "livebench_design",
          "title": "LiveBench Design",
          "isOverall": false,
          "modelCount": 32
        }
      ]
    },
    {
      "familyId": "aa",
      "title": "Artificial Analysis",
      "overall": "aa_intelligence_index_v5_0",
      "boards": [
        {
          "id": "aa_intelligence_index_v5_0",
          "title": "Artificial Analysis Intelligence Index v5.0",
          "isOverall": true,
          "modelCount": 28
        },
        {
          "id": "aa_briefcase_v1_1",
          "title": "AA-Briefcase v1.1",
          "isOverall": false,
          "modelCount": 28
        },
        {
          "id": "aa_automationbench",
          "title": "AutomationBench-AA",
          "isOverall": false,
          "modelCount": 29
        },
        {
          "id": "aa_frontiercode_v2_0",
          "title": "FrontierCode 2.0",
          "isOverall": false,
          "modelCount": 28
        },
        {
          "id": "aa_gdp_pdf",
          "title": "GDP.pdf",
          "isOverall": false,
          "modelCount": 28
        },
        {
          "id": "aa_hle_diamond",
          "title": "HLE-Diamond",
          "isOverall": false,
          "modelCount": 28
        },
        {
          "id": "aa_critpt_v2_hard",
          "title": "CritPt v2 (Hard Subset)",
          "isOverall": false,
          "modelCount": 28
        },
        {
          "id": "aa_terminal_bench_science_v0_1",
          "title": "Terminal-Bench-Science 0.1",
          "isOverall": false,
          "modelCount": 28
        },
        {
          "id": "aa_terminal_bench_v4_0",
          "title": "Terminal-Bench 4.0",
          "isOverall": false,
          "modelCount": 28
        },
        {
          "id": "aa_humanitys_last_exam",
          "title": "Humanity's Last Exam",
          "isOverall": false,
          "modelCount": 27
        },
        {
          "id": "aa_gpqa_diamond",
          "title": "GPQA Diamond",
          "isOverall": false,
          "modelCount": 27
        },
        {
          "id": "aa_scicode",
          "title": "SciCode",
          "isOverall": false,
          "modelCount": 27
        },
        {
          "id": "aa_lcr",
          "title": "AA LCR",
          "isOverall": false,
          "modelCount": 28
        },
        {
          "id": "aa_omniscience_index_v1_1",
          "title": "AA-Omniscience v1.1",
          "isOverall": false,
          "modelCount": 28
        },
        {
          "id": "aa_critpt",
          "title": "CritPt",
          "isOverall": false,
          "modelCount": 28
        },
        {
          "id": "aa_gdpval_elo",
          "title": "GDPval-AA Elo",
          "isOverall": false,
          "modelCount": 27
        },
        {
          "id": "aa_terminalbench_hard",
          "title": "Terminal-Bench Hard",
          "isOverall": false,
          "modelCount": 27
        },
        {
          "id": "aa_terminalbench_v2_1",
          "title": "Terminal-Bench v2.1",
          "isOverall": false,
          "modelCount": 27
        },
        {
          "id": "aa_ifbench",
          "title": "IFBench",
          "isOverall": false,
          "modelCount": 27
        },
        {
          "id": "aa_mmmu_pro",
          "title": "MMMU-Pro",
          "isOverall": false,
          "modelCount": 27
        },
        {
          "id": "aa_openness_index",
          "title": "Artificial Analysis Openness Index",
          "isOverall": false,
          "modelCount": 25
        },
        {
          "id": "aa_mlcr_overall",
          "title": "MLCR Overall",
          "isOverall": false,
          "modelCount": 27
        }
      ]
    },
    {
      "familyId": "deepswe",
      "title": "DeepSWE",
      "overall": "deepswe_v1_1",
      "boards": [
        {
          "id": "deepswe_v1_1",
          "title": "DeepSWE v1.1",
          "isOverall": true,
          "modelCount": 70
        }
      ]
    }
  ],
  "rankings": {
    "livebench_overall": {
      "rankingId": "livebench_overall",
      "benchmarkId": "livebench_overall",
      "familyId": "livebench",
      "title": "LiveBench Overall",
      "category": "overall",
      "release": "2026-10-25",
      "releaseId": "2026-10-25",
      "metric": "weighted_category_average",
      "unit": "score",
      "comparisonKey": "live_bench",
      "snapshotId": "6b282c7289de1228cc866b8735ce76bad1f477985032db8b6f07e1daa8e9d398",
      "contentHash": "6b282c7289de1228cc866b8735ce76bad1f477985032db8b6f07e1daa8e9d398",
      "generatedAt": "2026-10-31T09:34:08Z",
      "taskCount": 7,
      "source": {
        "name": "LiveBench dated official leaderboard CSV",
        "type": "official_site_dated_csv",
        "url": "https://livebench.ai/",
        "evidenceUrl": "https://livebench.ai/",
        "tableUrl": "https://livebench.ai/data/20261025/table.csv",
        "categoriesUrl": "https://livebench.ai/data/20261025/categories.json"
      },
      "coverage": null,
      "entries": [
        [
          "claude-fable-5.1",
          "claude-fable-5.1",
          85.69,
          null,
          null
        ],
        [
          "gpt-6-astra",
          "gpt-6-astra",
          85.64,
          null,
          null
        ],
        [
          "claude-opus-5.5",
          "claude-opus-5.5",
          85.14,
          null,
          null
        ],
        [
          "gpt-6.1-sol",
          "gpt-6.1-sol",
          84.07,
          null,
          null
        ],
        [
          "claude-sonnet-5.5",
          "claude-sonnet-5.5",
          80.04,
          null,
          null
        ],
        [
          "gemini-4-argon",
          "gemini-4-argon",
          79.3,
          null,
          null
        ],
        [
          "gpt-6.1-terra",
          "gpt-6.1-terra",
          77.79,
          null,
          null
        ],
        [
          "muse-wonder-1.0",
          "muse-wonder-1.0",
          74.15,
          null,
          null
        ],
        [
          "deepseek-v4.1-flash-1017",
          "deepseek-v4.1-flash-1017",
          72.87,
          null,
          null
        ],
        [
          "kimi-k3.1-pro",
          "kimi-k3.1-pro",
          71.29,
          null,
          null
        ],
        [
          "grok-4.7",
          "grok-4.7",
          70.14,
          null,
          null
        ],
        [
          "claude-haiku-5.5",
          "claude-haiku-5.5",
          69.85,
          null,
          null
        ],
        [
          "mimo-v2.6-pro",
          "mimo-v2.6-pro",
          68.48,
          null,
          null
        ],
        [
          "gpt-5.6-terra",
          "gpt-5.6-terra",
          67.79,
          null,
          null
        ],
        [
          "grok-4.6",
          "grok-4.6",
          67.75,
          null,
          null
        ],
        [
          "minimax-m3.1-flash",
          "minimax-m3.1-flash",
          66.89,
          null,
          null
        ],
        [
          "gpt-6-luna",
          "gpt-6-luna",
          64.59,
          null,
          null
        ],
        [
          "kimi-k3",
          "kimi-k3",
          64.57,
          null,
          null
        ],
        [
          "mistral-large-4-0",
          "mistral-large-4-0",
          63.49,
          null,
          null
        ],
        [
          "muse-spark-1.3",
          "muse-spark-1.3",
          63.03,
          null,
          null
        ],
        [
          "glm-5.3-flash",
          "glm-5.3-flash",
          62.07,
          null,
          null
        ],
        [
          "qwen3.8-max",
          "qwen3.8-max",
          61.56,
          null,
          null
        ],
        [
          "gemini-3.8-flash",
          "gemini-3.8-flash",
          59.21,
          null,
          null
        ],
        [
          "step-5-preview",
          "step-5-preview",
          58.61,
          null,
          null
        ],
        [
          "qwen3.8-27b",
          "qwen3.8-27b",
          58.38,
          null,
          null
        ],
        [
          "muse-spark-open",
          "muse-spark-open",
          51.63,
          null,
          null
        ],
        [
          "smaug-nemotron-3.5-nvfp4",
          "smaug-nemotron-3.5-nvfp4",
          50.31,
          null,
          null
        ],
        [
          "nemotron-super-vl-3.5",
          "nemotron-super-vl-3.5",
          50.23,
          null,
          null